{
  "event": null,
  "additional_entities": [
    null
  ],
  "article_body": null,
  "has_parts": [
    null
  ],
  "categories": [
    null
  ],
  "date_modified": "Earth",
  "identifier": 9228,
  "in_language": null,
  "is_part_of": null,
  "license": [
    null
  ],
  "main_entity": null,
  "name": "Earth",
  "abstract": "Earth",
  "namespace": null,
  "protection": [
    null
  ],
  "redirects": [
    null
  ],
  "templates": [
    null
  ],
  "url": "https://en.wikipedia.org/wiki/Earth",
  "version": null,
  "visibility": null
}